{
  "buyer_intent_keyword": "best AI receptionist for small business",
  "audience": "SMB phone teams that miss after-hours calls",
  "primary_tool": "cloudtalk",
  "competitors": ["retell-ai", "vapi", "intercom"],
  "conversion_goal": "qualified trial click",
  "affiliate_status": "approved",
  "current_date": "2026-06-29"
}
